{"$schema":"hocuspocus://schemas/catalog/v1","catalogFingerprint":"sha256:fafe738cedc31f48879881c76ddf96723b9435acc43ec25566335f7dcc764507","catalogVersion":1,"categories":[{"label":"Render","name":"Driver","networkFamily":"rop"},{"label":"Geometry","name":"Sop","networkFamily":"sop"}],"houdini":{"build":"21.0.123","featureFlags":["apex","karma_xpu"],"platform":"windows-x86_64","product":"Houdini","version":"21.0"},"kind":"hocus_catalog","operators":[{"aliases":["axisalign","labs_axis_align"],"category":"Sop","editable":false,"inputs":[{"cardinality":"one","categories":["Sop"],"dataTypes":["geometry"],"index":0,"label":"Geometry","name":"geometry"},{"cardinality":"optional","categories":["Sop"],"dataTypes":["geometry"],"index":1,"label":"Reference","name":"reference"},{"cardinality":"many","categories":["Sop"],"dataTypes":["geometry"],"index":null,"label":"Mask","name":"mask"}],"locked":true,"name":"axis_align","namespace":"labs","networkFamilies":["sop"],"outputs":[{"cardinality":"one","categories":["Sop"],"dataTypes":["geometry"],"index":0,"label":"Output","name":"output"}],"parameters":[{"assignable":false,"codeSurface":"none","default":null,"label":"Execute","menu":[],"range":null,"tags":{},"token":"execute","tupleNames":[],"tupleSize":1,"type":"button"},{"assignable":true,"codeSurface":"none","default":"","label":"Group","menu":[],"range":null,"tags":{"scope":"point"},"token":"group","tupleNames":[],"tupleSize":1,"type":"string"},{"assignable":true,"codeSurface":"none","default":"axis","label":"Method","menu":[{"label":"Axis","token":"axis"},{"label":"Normal","token":"normal"}],"range":null,"tags":{},"token":"method","tupleNames":[],"tupleSize":1,"type":"menu"},{"assignable":true,"codeSurface":"none","default":[1.0,1.0,1.0],"label":"Size","menu":[],"range":{"max":10,"maxInclusive":true,"min":0,"minInclusive":true},"tags":{},"token":"size","tupleNames":["sizex","sizey","sizez"],"tupleSize":3,"type":"tuple"},{"assignable":true,"codeSurface":"vex","default":"","label":"VEXpression","menu":[],"range":null,"tags":{},"token":"snippet","tupleNames":[],"tupleSize":1,"type":"code"}],"qualifiedName":"labs::sop::axis_align::2.0","source":{"hdaLibrary":{"assetName":"labs::axis_align","assetVersion":"2.0","contentDigest":"sha256:cccccccccccccccccccccccccccccccccccccccccccccccccccccccccccccccc","identity":"SideFXLabs/axis_align.hda"},"kind":"hda","packageId":"sidefx-labs"},"spareParameterPolicy":"declared_only","version":"2.0"},{"aliases":[],"category":"Sop","editable":true,"inputs":[{"cardinality":"one","categories":["Sop"],"dataTypes":[],"index":0,"label":"Input","name":"input"}],"locked":false,"name":"null","namespace":null,"networkFamilies":["sop"],"outputs":[{"cardinality":"one","categories":["Sop"],"dataTypes":[],"index":0,"label":"Output","name":"output"}],"parameters":[],"qualifiedName":"sop::null","source":{"hdaLibrary":null,"kind":"builtin","packageId":null},"spareParameterPolicy":"forbidden","version":null}],"packages":[{"contentDigest":"sha256:aaaaaaaaaaaaaaaaaaaaaaaaaaaaaaaaaaaaaaaaaaaaaaaaaaaaaaaaaaaaaaaa","id":"sidefx-labs","kind":"labs","name":"SideFX Labs","tags":{"vendor":"SideFX"},"version":"21.0.123"},{"contentDigest":"sha256:bbbbbbbbbbbbbbbbbbbbbbbbbbbbbbbbbbbbbbbbbbbbbbbbbbbbbbbbbbbbbbbb","id":"studio-tools","kind":"package","name":"Studio Tools","tags":{"channel":"release"},"version":"3.2.1"}]}
